<?xml version="1.0"?>
<!DOCTYPE TUITProperties PUBLIC "-//TUIT//TUITProperties/EN" "properties.dtd">
<TUITProperties>
    <DBConnection url="localhost" login="tuit" password="tuit"/>
    <BLASTNPath path="/bin/blastn"/>
    <TMPDir path="/home/alext/Downloads/tmp"/>
    <BLASTNParameters>
        <Database use="nt"/>
        <Expect value="1.0"/>
        <EntrezQuery value="bacteria not hybrid not other not uncultured not enrichment not unclassified not uncultivated not unspecified not environmental not metagenomes"/>
        <Remote delegate="yes"/>
        <MaxFilesInBatch value="50"/>
    </BLASTNParameters>
    <!--Higher Level-->
    <SpecificationParameters>
        <CutoffSet rank="superkingdom">
            <pIdentCutoff value="60"/>
            <QueryCoverageCutoff value="80"/>
            <EvalueRatioCutoff value="100"/>
        </CutoffSet>
    </SpecificationParameters>
    <SpecificationParameters>
        <CutoffSet rank="kingdom">
            <pIdentCutoff value="60"/>
            <QueryCoverageCutoff value="80"/>
            <EvalueRatioCutoff value="100"/>
        </CutoffSet>
    </SpecificationParameters>
    <SpecificationParameters>
        <CutoffSet rank="superphylum">
            <pIdentCutoff value="60"/>
            <QueryCoverageCutoff value="80"/>
            <EvalueRatioCutoff value="100"/>
        </CutoffSet>
    </SpecificationParameters>
    <SpecificationParameters>
        <CutoffSet rank="phylum">
            <pIdentCutoff value="60"/>
            <QueryCoverageCutoff value="80"/>
            <EvalueRatioCutoff value="100"/>
        </CutoffSet>
    </SpecificationParameters>
    <SpecificationParameters>
        <CutoffSet rank="subphylum">
            <pIdentCutoff value="60"/>
            <QueryCoverageCutoff value="80"/>
            <EvalueRatioCutoff value="100"/>
        </CutoffSet>
    </SpecificationParameters>
    <SpecificationParameters>
        <CutoffSet rank="superclass">
            <pIdentCutoff value="60"/>
            <QueryCoverageCutoff value="80"/>
            <EvalueRatioCutoff value="100"/>
        </CutoffSet>
    </SpecificationParameters>
    <SpecificationParameters>
        <CutoffSet rank="infraclass">
            <pIdentCutoff value="60"/>
            <QueryCoverageCutoff value="80"/>
            <EvalueRatioCutoff value="100"/>
        </CutoffSet>
    </SpecificationParameters>
    <SpecificationParameters>
        <CutoffSet rank="c_lass">
            <pIdentCutoff value="60"/>
            <QueryCoverageCutoff value="80"/>
            <EvalueRatioCutoff value="100"/>
        </CutoffSet>
    </SpecificationParameters>
    <SpecificationParameters>
        <CutoffSet rank="subclass">
            <pIdentCutoff value="60"/>
            <QueryCoverageCutoff value="80"/>
            <EvalueRatioCutoff value="100"/>
        </CutoffSet>
    </SpecificationParameters>
    <!--Order Level-->
    <SpecificationParameters>
        <CutoffSet rank="infraorder">
            <pIdentCutoff value="80"/>
            <QueryCoverageCutoff value="90"/>
            <EvalueRatioCutoff value="100"/>
        </CutoffSet>
    </SpecificationParameters>
    <SpecificationParameters>
        <CutoffSet rank="parvorder">
            <pIdentCutoff value="70"/>
            <QueryCoverageCutoff value="90"/>
            <EvalueRatioCutoff value="100"/>
        </CutoffSet>
    </SpecificationParameters>
    <SpecificationParameters>
        <CutoffSet rank="superorder">
            <pIdentCutoff value="70"/>
            <QueryCoverageCutoff value="90"/>
            <EvalueRatioCutoff value="100"/>
        </CutoffSet>
    </SpecificationParameters>
    <SpecificationParameters>
        <CutoffSet rank="order">
            <pIdentCutoff value="70"/>
            <QueryCoverageCutoff value="90"/>
            <EvalueRatioCutoff value="100"/>
        </CutoffSet>
    </SpecificationParameters>
    <SpecificationParameters>
        <CutoffSet rank="suborder">
            <pIdentCutoff value="70"/>
            <QueryCoverageCutoff value="90"/>
            <EvalueRatioCutoff value="100"/>
        </CutoffSet>
    </SpecificationParameters>
    <!--Family Level-->
    <SpecificationParameters>
        <CutoffSet rank="superfamily">
            <pIdentCutoff value="80"/>
            <QueryCoverageCutoff value="90"/>
            <EvalueRatioCutoff value="100"/>
        </CutoffSet>
    </SpecificationParameters>
    <SpecificationParameters>
        <CutoffSet rank="family">
            <pIdentCutoff value="80"/>
            <QueryCoverageCutoff value="90"/>
            <EvalueRatioCutoff value="100"/>
        </CutoffSet>
    </SpecificationParameters>
    <SpecificationParameters>
        <CutoffSet rank="subfamily">
            <pIdentCutoff value="80"/>
            <QueryCoverageCutoff value="90"/>
            <EvalueRatioCutoff value="100"/>
        </CutoffSet>
    </SpecificationParameters>
    <SpecificationParameters>
        <CutoffSet rank="tribe">
            <pIdentCutoff value="80"/>
            <QueryCoverageCutoff value="90"/>
            <EvalueRatioCutoff value="100"/>
        </CutoffSet>
    </SpecificationParameters>
    <SpecificationParameters>
        <CutoffSet rank="subtribe">
            <pIdentCutoff value="80"/>
            <QueryCoverageCutoff value="90"/>
            <EvalueRatioCutoff value="100"/>
        </CutoffSet>
    </SpecificationParameters>
    <!--Genus Level-->
    <SpecificationParameters>
        <CutoffSet rank="genus">
            <pIdentCutoff value="95"/>
            <QueryCoverageCutoff value="90"/>
            <EvalueRatioCutoff value="100"/>
        </CutoffSet>
    </SpecificationParameters>
    <SpecificationParameters>
        <CutoffSet rank="subgenus">
            <pIdentCutoff value="95"/>
            <QueryCoverageCutoff value="90"/>
            <EvalueRatioCutoff value="100"/>
        </CutoffSet>
    </SpecificationParameters>
    <!--Species Level-->
    <SpecificationParameters>
        <CutoffSet rank="species_group">
            <pIdentCutoff value="97.5"/>
            <QueryCoverageCutoff value="95"/>
            <EvalueRatioCutoff value="100"/>
        </CutoffSet>
    </SpecificationParameters>
    <SpecificationParameters>
        <CutoffSet rank="species_subgroup">
            <pIdentCutoff value="97.5"/>
            <QueryCoverageCutoff value="95"/>
            <EvalueRatioCutoff value="100"/>
        </CutoffSet>
    </SpecificationParameters>
    <SpecificationParameters>
        <CutoffSet rank="species">
            <pIdentCutoff value="97.5"/>
            <QueryCoverageCutoff value="95"/>
            <EvalueRatioCutoff value="100"/>
        </CutoffSet>
    </SpecificationParameters>
    <SpecificationParameters>
        <CutoffSet rank="subspecies">
            <pIdentCutoff value="97.5"/>
            <QueryCoverageCutoff value="95"/>
            <EvalueRatioCutoff value="100"/>
        </CutoffSet>
    </SpecificationParameters>
    <SpecificationParameters>
        <CutoffSet rank="varietas">
            <pIdentCutoff value="97.5"/>
            <QueryCoverageCutoff value="95"/>
            <EvalueRatioCutoff value="100"/>
        </CutoffSet>
    </SpecificationParameters>
    <SpecificationParameters>
        <CutoffSet rank="forma">
            <pIdentCutoff value="97.5"/>
            <QueryCoverageCutoff value="95"/>
            <EvalueRatioCutoff value="100"/>
        </CutoffSet>
    </SpecificationParameters>
    <!-- -->
</TUITProperties>